index,url,valid,domain,title,description,image,published,archive,content,quote,language,keyword
https://www.tagesspiegel.de/berlin/reinickendorf-bundesweit-vorreiter-erste-vollzeit-einsamkeitsbeauftragte-startet-in-berlin-ihren-dienst-11148007.html,https://www.tagesspiegel.de/berlin/reinickendorf-bundesweit-vorreiter-erste-vollzeit-einsamkeitsbeauftragte-startet-in-berlin-ihren-dienst-11148007.html,0,www.tagesspiegel.de,Reinickendorf bundesweit Vorreiter: Erste Vollzeit-Einsamkeitsbeauftragte startet in Berlin ihren Dienst,"Die 39-jährige Annabell Paris kümmert sich ab sofort um ein Konzept, das Einsamkeit im Bezirk Reinickendorf untersucht. In Berlin ist jeder zehnte Einwohner ist von Einsamkeit betroffen.",https://www.tagesspiegel.de/images/senior-auf-einer-bank/alternates/BASE_16_9_W1400/senior-auf-einer-bank.jpeg,2024-02-01T17:05:39Z,,"Als bundesweit Erste ihrer Art hat Annabell Paris in Berlin-Reinickendorf ihre Stelle als vollzeitbeschäftigte Einsamkeitsbeauftragte angetreten. Die 39-Jährige kümmert sich ab sofort um ein Konzept,… [+1069 chars]",,de,'Einsamkeit'
https://www.tagesspiegel.de/kultur/all-of-us-strangers-im-kino-die-macht-der-liebe-11147578.html,https://www.tagesspiegel.de/kultur/all-of-us-strangers-im-kino-die-macht-der-liebe-11147578.html,0,www.tagesspiegel.de,„All Of Us Strangers“ im Kino: Die Macht der Liebe,Regisseur Andrew Haigh erzählt in „All Of Us Strangers“ aufwühlend und gefühlspolitisch klar von Einsamkeit und dem Erwachen schwuler Begehren.,https://www.tagesspiegel.de/images/all-of-us-strangers/alternates/BASE_16_9_W1400/all-of-us-strangers.jpeg,2024-02-03T16:39:51Z,,"Es sind Vampire an der Tür, sagt der attraktive junge Mann (Paul Mescal), offensichtlich ziemlich betrunken, mit einem zweideutigen Lächeln. Eine merkwürdige Begegnung unter Nachbarn in einem Apartme… [+6622 chars]",,de,'Einsamkeit'
https://www.zeit.de/news/2024-02/06/wintereinbruch-in-china-chaos-vor-dem-fruehlingsfest,https://www.zeit.de/news/2024-02/06/wintereinbruch-in-china-chaos-vor-dem-fruehlingsfest,0,www.zeit.de,Wetter: Wintereinbruch in China - Chaos vor dem Frühlingsfest,Hier finden Sie Informationen zu dem Thema „Wetter“. Lesen Sie jetzt „Wintereinbruch in China - Chaos vor dem Frühlingsfest“.,https://img.zeit.de/news/2024-02/06/wintereinbruch-in-china-chaos-vor-dem-fruehlingsfest-image-group/wide__1300x731,2024-02-06T08:39:41Z,,Ungewöhnlich heftige Schneefälle und Frost haben in Zentralchina während der Hauptreisezeit vor dem nahenden Frühlingsfest zu langen Staus sowie Zug- und Flugausfällen geführt. Besonders hart traf es… [+2579 chars],,de,'Wintereinbruch'
https://www.tagesschau.de/ausland/asien/china-fruehlingsfest-reisen-100.html,https://www.tagesschau.de/ausland/asien/china-fruehlingsfest-reisen-100.html,0,www.tagesschau.de,Wintereinbruch lässt Reisende in China vor Frühlingsfest stranden,"Ungewöhnlich heftige Schneefälle haben mitten in der Hauptreisezeit vor dem Frühlingsfest in China für Chaos auf Straßen, Schienen und im Flugverkehr gesorgt. Manche Reisende saßen stundenlang fest.",https://images.tagesschau.de/image/f97c2c74-5161-4870-b5d6-ee4788dfb0d8/AAABjX4A6ok/AAABibBxqrQ/16x9-1280/china-schnee-104.jpg,2024-02-06T10:48:26Z,,"Stand: 06.02.2024 11:48 Uhr
Ungewöhnlich heftige Schneefälle haben mitten in der Hauptreisezeit vor dem Frühlingsfest in China für Chaos auf Straßen, Schienen und im Flugverkehr gesorgt. Manche Reis… [+2114 chars]",,de,'Wintereinbruch'
https://www.dw.com/de/windkraftausbau-in-deutschland-in-gefahr/a-68152918,https://www.dw.com/de/windkraftausbau-in-deutschland-in-gefahr/a-68152918,0,www.dw.com,Windkraftausbau in Deutschland in Gefahr?,"Deutschland will den Strom aus Windanlagen auf dem Meer bis 2030 fast vervierfachen. Branchenvertreter sehen diese Ziele jetzt in Gefahr, auch wegen der Infrastruktur in den Seehäfen. Bundeskanzler Olaf Scholz scheint optimistisch: Die Koalition aus seiner SP…",https://static.dw.com/image/65123383_6.jpg,2024-02-07T10:52:00Z,,"Bundeskanzler Olaf Scholz scheint optimistisch: Die Koalition aus seiner SPD mit den Grünen und der FDP will die Energiewende weiter voranbringen. Trotz aller Haushalts-Probleme, trotz einer immer sp… [+6179 chars]",,de,'Infrastruktur Gefahr'
https://www.brigitte.de/liebe/persoenlichkeit/psychologie--1000-benachrichtigungen-und-trotzdem-einsam-13767244.html,https://www.brigitte.de/liebe/persoenlichkeit/psychologie--1000-benachrichtigungen-und-trotzdem-einsam-13767244.html,0,www.brigitte.de,Psychologie: 1000 Benachrichtigungen und trotzdem allein – macht uns das Internet einsam?,"In Deutschland fühlen sich immer mehr Menschen allein, das haben Studien ergeben. Doch bringt uns das Internet nicht über alle Grenzen hinweg zusammen? Oder ist es sogar schuld an unserer Einsamkeit?",https://image.brigitte.de/13767470/t/Ns/v5/w1440/r1.7778/-/internet-und-einsamkeit.jpg,2024-02-08T09:23:00Z,,"08.02.2024, 10:23
 2 Min.
In Deutschland fühlen sich immer mehr Menschen allein, das haben Studien ergeben. Doch bringt uns das Internet nicht über alle Grenzen hinweg zusammen? Oder ist es sogar s… [+4421 chars]",,de,'Einsamkeit'
