index,url,valid,domain,title,description,image,published,archive,content,quote,language,keyword
https://www.zeit.de/news/2023-01/01/schweitzer-bereitet-strategie-gegen-einsamkeit-vor,https://www.zeit.de/news/2023-01/01/schweitzer-bereitet-strategie-gegen-einsamkeit-vor,0,www.zeit.de,Sozialminister: Schweitzer bereitet Strategie gegen Einsamkeit vor,,,2023-01-01T11:10:58Z,,"When browsing with ads:
We collect personal data and also transmit it to third-party providers
 that help us improve and finance our digital content. Some of the information stored on your device, … [+732 chars]",,de,'Einsamkeit'
https://www.sueddeutsche.de/muenchen/freising/malteser-hilfsdienst-freising-besuchshunde-besuchsdienst-therapiehunde-1.5725574,https://www.sueddeutsche.de/muenchen/freising/malteser-hilfsdienst-freising-besuchshunde-besuchsdienst-therapiehunde-1.5725574,0,www.sueddeutsche.de,Neues Angebot in Freising: Besuch mit Hund,Die Mensch-Hunde-Teams der Malteser sind ausgebildet. Allein lebende Senioren sollen bei Treffen mit ihnen aus ihrer Einsamkeit herausgeholt werden.,https://www.sueddeutsche.de/image/sz.1.5725576/1200x675?v=1672667034,2023-01-02T16:13:54Z,,Die Mensch-Hunde-Teams der Malteser sind ausgebildet. Allein lebende Senioren sollen bei Treffen mit ihnen aus ihrer Einsamkeit herausgeholt werden. Den Probelauf zumindest haben sie bravourös gemeis… [+3832 chars],,de,'Einsamkeit'
https://www.zeit.de/news/2023-01/03/senioren-betaetigen-hausnotruf-vielfach-aus-einsamkeit,https://www.zeit.de/news/2023-01/03/senioren-betaetigen-hausnotruf-vielfach-aus-einsamkeit,0,www.zeit.de,Malteser: Senioren betätigen Hausnotruf vielfach aus Einsamkeit,,,2023-01-03T09:46:24Z,,"When browsing with ads:
We collect personal data and also transmit it to third-party providers
 that help us improve and finance our digital content. Some of the information stored on your device, … [+732 chars]",,de,'Einsamkeit'
