index,url,valid,domain,title,description,image,published,archive,content,quote,language,keyword
https://www.bild.de/sport/mehr-sport/wintersport-heute-im-tv-wer-uebertraegt-die-nordische-ski-wm-und-ski-alpin-67c071d1f0c49c5db213af41,https://www.bild.de/sport/mehr-sport/wintersport-heute-im-tv-wer-uebertraegt-die-nordische-ski-wm-und-ski-alpin-67c071d1f0c49c5db213af41,0,www.bild.de,Nordische Ski-WM und Ski-Alpin - Wer überträgt Wintersport heute im TV?,"Dem Wintersport-Fan wird heute einiges geboten. BILD verrät Ihnen, wann und wo Sie welche Disziplin im TV und Livestream verfolgen können.","https://images.bild.de/67c071d1f0c49c5db213af41/c64339f36a3aa7444815a28921ee10cf,9240e2c3?w=1280",2025-03-01T05:00:15Z,,"Wintersport heute im TV: Spannung pur mit der Nordischen Ski-WM und Ski Alpin.
Heute steht für Wintersport-Fans ein abwechslungsreicher Tag im TV bevor. Die Nordische Ski-WM in Trondheim bietet hoch… [+2350 chars]",,de,'Wintersport'
https://www.stern.de/gesellschaft/regional/thueringen/wintersport--fuenf-skilifte-im-thueringer-wald-geoeffnet-35509928.html,https://www.stern.de/gesellschaft/regional/thueringen/wintersport--fuenf-skilifte-im-thueringer-wald-geoeffnet-35509928.html,0,www.stern.de,Wintersport: Fünf Skilifte im Thüringer Wald geöffnet,"Der Winter im Thüringer Wald ist weitgehend ausgefallen, nur einzelne mit Kunstschnee versehene Skihänge boten Wintersportfreuden. Am ersten Märzwochenende ist Skifahren dort noch möglich.",https://image.stern.de/35509966/t/lm/v1/w1440/r1.7778/-/01--xv5qf5vvecv3axs2048jpeg---2eaa7f9143ab71df.jpg,2025-03-01T10:10:53Z,,"Kopiere den aktuellen Link
Zur Merkliste hinzufügen
Der Winter im Thüringer Wald ist weitgehend ausgefallen, nur einzelne mit Kunstschnee versehene Skihänge boten Wintersportfreuden. Am ersten März… [+862 chars]",,de,'Wintersport'
https://www.welt.de/politik/ausland/plus255600682/Ukraine-Hilfen-Der-Joker-der-Europas-Geldsorgen-auf-einen-Schlag-loesen-koennte.html,https://www.welt.de/politik/ausland/plus255600682/Ukraine-Hilfen-Der-Joker-der-Europas-Geldsorgen-auf-einen-Schlag-loesen-koennte.html,0,www.welt.de,"Der Joker, der Europas Geldsorgen auf einen Schlag lösen könnte","Europa braucht Hunderte Milliarden Euro für die Verteidigung, aber die Finanzierung ist offen. Nun erwägt Norwegen, seinen 1,7 Billionen Euro schweren Staatsfonds dafür anzuzapfen. Doch ausgerechnet Ex-Nato-Generalsekretär Jens Stoltenberg könnte einen Strich…",https://img.welt.de/img/politik/ausland/mobile255602812/6627930247-ci16x9-w1200-fnov-fpotl-fpi157750653/Britain-Approves-Controversial-Oil-And-Gas-Field.jpg,2025-03-04T16:23:28Z,http://archive.md/20250304162808/https://www.welt.de/politik/ausland/plus255600682/Ukraine-Hilfen-Der-Joker-der-Europas-Geldsorgen-auf-einen-Schlag-loesen-koennte.html,"Europa braucht Hunderte Milliarden Euro für die Verteidigung, aber die Finanzierung ist offen. Nun erwägt Norwegen, seinen 1,7 Billionen Euro schweren Staatsfonds dafür anzuzapfen. Doch ausgerechnet … [+86 chars]",,de,'Geldsorgen'
