index,url,valid,domain,title,description,image,published,archive,content,quote,language,keyword
https://www.stern.de/gesellschaft/regional/nordrhein-westfalen/brauchtum--steeler-weihnachtsmarkt-oeffnet---einer-der-ersten-in-nrw-35193530.html,https://www.stern.de/gesellschaft/regional/nordrhein-westfalen/brauchtum--steeler-weihnachtsmarkt-oeffnet---einer-der-ersten-in-nrw-35193530.html,0,www.stern.de,Brauchtum: Steeler Weihnachtsmarkt öffnet - einer der ersten in NRW,"Glühwein, Lebkuchen und Lichterglanz schon Anfang November: Das gibt es alljährlich beim Weihnachtsmarkt in Essen-Steele. Erwartet wird wieder eine sechsstellige Besucherzahl.",https://image.stern.de/35193532/t/ig/v1/w1440/r1.7778/-/02--zyrd32qaxev14axw800h600jpeg---689c6b860d4b6a20.jpg,2024-11-02T04:00:36Z,,"Kopiere den aktuellen Link
Glühwein, Lebkuchen und Lichterglanz schon Anfang November: Das gibt es alljährlich beim Weihnachtsmarkt in Essen-Steele. Erwartet wird wieder eine sechsstellige Besucherz… [+1393 chars]",,de,'Weihnachtsmarkt'
https://www.stern.de/panorama/brauchtum--es-geht-schon-wieder-los--erste-weihnachtsmaerkte-offen-35193494.html,https://www.stern.de/panorama/brauchtum--es-geht-schon-wieder-los--erste-weihnachtsmaerkte-offen-35193494.html,0,www.stern.de,Brauchtum: Es geht schon wieder los: Erste Weihnachtsmärkte offen,"Lebkuchen im Supermarkt schon seit Wochen, jetzt auch wieder Märkte mit Glühwein. Lichterglanz schon Anfang November bietet etwa der Weihnachtsmarkt in Essen-Steele.",https://image.stern.de/35193496/t/fG/v1/w1440/r1.7778/-/02--qysywuwru3v3axw800h600jpeg---530b22e932fa6bba.jpg,2024-11-02T04:00:37Z,,"Kopiere den aktuellen Link
Lebkuchen im Supermarkt schon seit Wochen, jetzt auch wieder Märkte mit Glühwein. Lichterglanz schon Anfang November bietet etwa der Weihnachtsmarkt in Essen-Steele.
Eine… [+1536 chars]",,de,'Weihnachtsmarkt'
https://www.tagesspiegel.de/gesellschaft/panorama/brauchtum-es-geht-schon-wieder-los-erste-weihnachtsmarkte-offen-12634259.html,https://www.tagesspiegel.de/gesellschaft/panorama/brauchtum-es-geht-schon-wieder-los-erste-weihnachtsmarkte-offen-12634259.html,0,www.tagesspiegel.de,Brauchtum: Es geht schon wieder los: Erste Weihnachtsmärkte offen,"Lebkuchen im Supermarkt schon seit Wochen, jetzt auch wieder Märkte mit Glühwein. Lichterglanz schon Anfang November bietet etwa der Weihnachtsmarkt in Essen-Steele.",https://www.tagesspiegel.de/images/12634256/alternates/BASE_16_9_W1400/1730520145000/weihnachtsmarkt-essen-steele.jpeg,2024-11-02T04:02:25Z,,Einer der ersten Weihnachtsmärkte bundesweit öffnet am Samstag im Essener Stadtteil Steele. Der Markt startet traditionell deutlich früher als andere Märkte unmittelbar nach Allerheiligen und dauert … [+1423 chars],,de,'Weihnachtsmarkt'
https://www.faz.net/aktuell/rhein-main/frankfurt/aldi-weihnachtsmarkt-werbeaktion-erzuernt-weihnachtsmarktveranstalter-110085723.html,https://www.faz.net/aktuell/rhein-main/frankfurt/aldi-weihnachtsmarkt-werbeaktion-erzuernt-weihnachtsmarktveranstalter-110085723.html,0,www.faz.net,Glühwein für einen Euro: Das denken Schausteller über den Aldi-Weihnachtsmarkt,Ärger noch ehe die erste Kerze brennt: Eine Aldi-Werbeaktion noch vor dem ersten Advent erzürnt Schausteller wie Weihnachtsmarktveranstalter. Es geht um mehr als um Glühwein für einen Euro.,https://media1.faz.net/ppmedia/aktuell/4093183699/1.10085721/facebook_teaser/das-original-ein-gluehwein-in.jpg,2024-11-02T11:34:32Z,,"Es wurde eine Erfolgsgeschichte, in Birmingham schwärmen die Massen fast sieben Wochen lang durch die Straßen und feiern bei durchweg in deutscher Sprache benannten Produkten von Glühwein, über den A… [+4159 chars]",,de,'Weihnachtsmarkt'
https://www.tagesspiegel.de/gesellschaft/panorama/weihnachtsmarkte-100-jahre-alte-25-meter-tanne-fur-dresdens-weihnachtsmarkt-12634922.html,https://www.tagesspiegel.de/gesellschaft/panorama/weihnachtsmarkte-100-jahre-alte-25-meter-tanne-fur-dresdens-weihnachtsmarkt-12634922.html,0,www.tagesspiegel.de,Weihnachtsmärkte: 100 Jahre alte 25-Meter-Tanne für Dresdens Weihnachtsmarkt,Der Striezelmarkt gehört seit fast 600 Jahren zur Vorweihnachtszeit. Er lockt heute Besucher aus aller Welt an. Der große Weihnachtsbaum für den Dresdner Altmarkt ist jetzt schon eingetroffen.,https://www.tagesspiegel.de/images/12634919/alternates/BASE_16_9_W1400/1730550167000/aufstellen-der-tanne-auf-dem-striezelmarkt.jpeg,2024-11-02T12:22:47Z,,Der große Weihnachtsbaum für den diesjährigen Dresdner Striezelmarkt ist schon da. Die etwa 25 Meter hohe Nordmanntanne wurde am Samstagmorgen in Freital gefällt und per Tieflader auf den Altmarkt tr… [+574 chars],,de,'Weihnachtsmarkt'
