index,url,valid,domain,title,description,image,published,archive,content,quote,language,keyword
https://www.stern.de/kultur/backstreet-boys-in-oesterreich--zusatzkonzert-bei-ski-opening-in-schladming-35878402.html,https://www.stern.de/kultur/backstreet-boys-in-oesterreich--zusatzkonzert-bei-ski-opening-in-schladming-35878402.html,0,www.stern.de,Backstreet Boys in Österreich: Zusatzkonzert bei Ski-Opening in Schladming,Zum Start der Skisaison 2025/2026 treten die Backstreet Boys am 6. Dezember in Schladming auf. Jetzt geben sie ein weiteres Konzert.,https://image.stern.de/35878406/t/IL/v1/w1440/r1.7778/-/08--zusatzkonzert-bei-ski-opening-in-schladming---16-9---spoton-article-1104923.jpg,2025-07-08T21:45:00Z,,"Kopiere den aktuellen Link
Zur Merkliste hinzufügen
Zum Start der Skisaison 2025/2026 treten die Backstreet Boys am 6. Dezember in Schladming auf. Jetzt geben sie ein weiteres Konzert.
Der Ansturm… [+2042 chars]",,de,'Skisaison'
https://www.focus.de/politik/ausland/spionage-angst-us-regierung-verbietet-china-den-kauf-von-agrarflaechen_893b4929-43a6-4d53-9836-9be78bf9ca2b.html,https://www.focus.de/politik/ausland/spionage-angst-us-regierung-verbietet-china-den-kauf-von-agrarflaechen_893b4929-43a6-4d53-9836-9be78bf9ca2b.html,0,www.focus.de,Spionage-Angst: US-Regierung verbietet China den Kauf von Agrarflächen,"Die USA verbieten chinesischen Investoren, Land zu kaufen. Damit will man die nationale Sicherheit und die Nahrungsmittelversorgung schützen.",https://quadro.burda-forward.de/ctf/25227a7c-a717-40d1-b9ef-831bc25c3def.dea4e249-a9b4-4717-8c83-3c6117bae473.jpg?im=RegionOfInterestCrop%3D%281200%2C630%29%2CregionOfInterest%3D%281404%2C591%29&hash=3713ba98d65df90cb9e648b09f4cc3e1fe55587c1d321f6cb50751b3ff9bb56b,2025-07-09T10:12:52Z,,"Die US-Regierung verbietet den Kauf von Agrarland durch chinesische Investoren. Man sehe durch solche Käufe die nationalen Sicherheit gefährdet, berichtetet der Telegraph. US-Landwirtschaftsministeri… [+2734 chars]",,de,'Nahrungsmittelversorgung'
https://www.zeit.de/2025/29/alexander-zverev-tennis-einsamkeit-wimbledon,https://www.zeit.de/2025/29/alexander-zverev-tennis-einsamkeit-wimbledon,0,www.zeit.de,Alexander Zverev: Überbezahlte Isolation,"Alexander Zverev verliert in Wimbledon und klagt danach über Einsamkeit. Das ist bezeichnend für eine Branche, die ihre Toptalente in überbezahlte Isolation drängt.",https://img.zeit.de/2025/29/ueberbezahlte-isolation-bild-3/wide__1300x731,2025-07-09T10:14:08Z,http://archive.md/20250709102427/https://www.zeit.de/2025/29/alexander-zverev-tennis-einsamkeit-wimbledon,"In diesem Text wird es um (sehr) privilegierte Menschen gehen, die leiden. Wenn das auf Anhieb unsympathisch klingt, dann ist das verständlich. Es soll trotzdem einen Erklärungsversuch geben. Der mom… [+499 chars]",,de,'Einsamkeit'
https://www.tagesspiegel.de/sport/wimbledon-das-tut-weh-die-einsamkeit-von-tennisprofis-13994840.html,https://www.tagesspiegel.de/sport/wimbledon-das-tut-weh-die-einsamkeit-von-tennisprofis-13994840.html,0,www.tagesspiegel.de,Wimbledon: „Das tut weh“: Die Einsamkeit von Tennisprofis,Alexander Zverev hat mit seinen eindrücklichen Worten eine Debatte im Tennis verstärkt. Woher kommen die mentalen Probleme bei den Profis - und was kann helfen?,https://www.tagesspiegel.de/images/13994837/alternates/BASE_16_9_W1400/1752056834000/tennis-wimbledon-2025.jpeg,2025-07-09T10:27:15Z,,Alexander Zverevs Worte über Einsamkeit und eine mögliche Therapie hallen nach im All England Club. Auch lange nach den eindrücklichen Aussagen der deutschen Nummer Eins bei seinem Wimbledon-Abschied… [+3846 chars],,de,'Einsamkeit'
https://www.nzz.ch/video/wie-maenner-zu-incels-werden-wie-gefaehrlich-sie-sind-und-was-beim-ausstieg-hilft-ld.1892131,https://www.nzz.ch/video/wie-maenner-zu-incels-werden-wie-gefaehrlich-sie-sind-und-was-beim-ausstieg-hilft-ld.1892131,0,www.nzz.ch,"VIDEO - Einsamkeit, Wut, Frauenfeindlichkeit: Das steckt hinter dem Incel-Phänomen","Sie fühlen sich von der Gesellschaft zurückgewiesen und radikalisieren sich in Online-Communities: Incels. Doch wie entsteht dieses Weltbild – und was hilft, um es wieder zu verlassen?","https://img.nzz.ch/2025/07/08/ba980699-bd62-475f-b7fe-7819da1b63eb.jpeg?width=1200&height=675&fit=bounds&quality=75&auto=webp&crop=3840,2160,x0,y0&wmark=nzz",2025-07-09T15:00:00Z,,"Wie werden Männer zu Incels?
«Frauen stehen auf einen Mann, der ihnen in allen Belangen überlegen ist.»«Sie sagt, sie möchte einen netten Mann, geht aber mit dem bösen Mann nach Hause.»
Wie radikal… [+18428 chars]",,de,'Einsamkeit'
https://www.diepresse.com/19661488/sommer-in-lappland-wenn-die-nacht-nie-dunkel-wird,https://www.diepresse.com/19661488/sommer-in-lappland-wenn-die-nacht-nie-dunkel-wird,0,www.diepresse.com,Sommer in Lappland: Wenn die Nacht nie dunkel wird [premium],Bislang ist Lappland eher für Nordlichter und Wintersport bekannt. Dabei hat das nordische Land im Sommer noch viel mehr zu bieten: etwa ein Treffen mit dem Weihnachtsmann höchstpersönlich und das erste Influencer-Rentier der Welt.,https://img.diepresse.com/public/incoming/g37nq8-fec67732-58bb-4c9f-b151-1742d80f44ab.jpg/alternates/DPR_SOCIAL_MAGAZIN/fec67732-58bb-4c9f-b151-1742d80f44ab.jpg,2025-07-10T12:37:52Z,,Bislang ist Lappland eher für Nordlichter und Wintersport bekannt. Dabei hat das nordische Land im Sommer noch viel mehr zu bieten: etwa ein Treffen mit dem Weihnachtsmann höchstpersönlich und das er… [+994 chars],,de,'Wintersport'
https://www.bild.de/leben-wissen/einsamkeit-juengere-fuehlen-sich-haeufiger-allein-als-aeltere-686fe93b42216d6f5d53729a,https://www.bild.de/leben-wissen/einsamkeit-juengere-fuehlen-sich-haeufiger-allein-als-aeltere-686fe93b42216d6f5d53729a,0,www.bild.de,Überraschendes Studienergebnis - Einsamkeit trifft nicht nur die Ältesten,"Im Alter fühlen sich Menschen oft einsam. Doch neue Zahlen belegen, dass es noch häufiger die mittlere Generation ist, die mit diesem Problem kämpft.","https://images.bild.de/686fe93b42216d6f5d53729a/f25b4d965a0365e086edb20043f904c3,e9dfb396?w=1280",2025-07-11T09:04:23Z,,"Um den TTS Player darzustellen, brauchen wir deine Zustimmung. 
 externen Inhalt aktivieren Um eingebettete Inhalte anzuzeigen, ist Ihre jederzeit widerrufliche Einwilligung (über den Schalter oder … [+2206 chars]",,de,'Einsamkeit'
https://www.stern.de/fotografie/alltag-in-den-usa--gregory-crewdson-zeigt-das-grauen-der-normalitaet-35463082.html,https://www.stern.de/fotografie/alltag-in-den-usa--gregory-crewdson-zeigt-das-grauen-der-normalitaet-35463082.html,0,www.stern.de,Fotografie: Diese Bilder zeigen die Abgründe des amerikanischen Alltags,"Der US-Amerikaner Gregory Crewdson inszeniert seit den 80er-Jahren poetische Fotografien. Sie erzählen von Einsamkeit und Isolation, von Sehnsucht und Traurigkeit.",https://image.stern.de/35462912/t/70/v5/w1440/r1.7778/-/gregory-crewdson-untitled-from-the-series-twilight-1998-2002-c-gregory-crewdson.jpg,2025-07-11T14:18:00Z,,"Kopiere den aktuellen Link
Zur Merkliste hinzufügen
Der US-Amerikaner Gregory Crewdson inszeniert seit den 80er-Jahren poetische Fotografien. Sie erzählen von Einsamkeit und Isolation, von Sehnsuch… [+2182 chars]",,de,'Einsamkeit'
https://www.kino.de/film/superman-2025/news/superman-ende-deshalb-taucht-spoiler-so-betrunken-in-der-festung-der-einsamkeit-auf/,https://www.kino.de/film/superman-2025/news/superman-ende-deshalb-taucht-spoiler-so-betrunken-in-der-festung-der-einsamkeit-auf/,0,www.kino.de,"""Superman""-Ende: Deshalb taucht [Spoiler] so betrunken in der Festung der Einsamkeit auf","Für Film- und Serienfans war dieser Anblick sicherlich ungewöhnlich, wer die zugrundeliegenden Comics kennt, wird aber weniger überrascht gewesen sein.",https://static.kino.de/wp-content/uploads/2025/07/rev-1-SPMN-CC-TRL-0027_High_Res_JPEG-rcm1200x627u.jpeg,2025-07-13T06:57:26Z,,"Für Film- und Serienfans war dieser Anblick sicherlich ungewöhnlich, wer die zugrundeliegenden Comics kennt, wird aber weniger überrascht gewesen sein.
– Achtung, es folgen Spoiler zum Ende von „Sup… [+2604 chars]",,de,'Einsamkeit'
https://burgenland.orf.at/stories/3313377/,https://burgenland.orf.at/stories/3313377/,0,burgenland.orf.at,Land stoppt Finanzierung für Hilfsprojekt,Das Projekt „Nachbarschaftshilfe Plus“ unterstützt seit mehr als zehn Jahren ältere und hilfsbedürftige Menschen im Alltag. Mit Jahresende stellt das Land allerdings die finanzielle Unterstützung ein und will ein eigenes Sozial-Projekt auf die Beine stellen.,https://ibs.orf.at/bgl?image=https%3A%2F%2Foekastatic.orf.at%2Fmims%2F2025%2F29%2F07%2Fcrops%2Fw%3D1200%2Ch%3D627%2Cq%3D75%2F2696337_master_1037707_nachbar3.jpg%3Fs%3Df6e604e55fb1432d54cf9f1f06ac38b87485d5a9,2025-07-13T10:23:11Z,,"Seit 2014 gibt es die Initiative Nachbarschaftshilfe Plus, seit 2017 wird sie vom Land mitfinanziert. Aktuell sind es 19 Gemeinden, die rund 40 Prozent der Kosten vom Land gefördert bekommen, damit H… [+1573 chars]",,de,'Nachbarschaftshilfe'
https://www.horizont.net/marketing/nachrichten/globale-kampagne-mit-diesem-beruehrenden-alien-film-kaempft-nivea-gegen-einsamkeit-229137,https://www.horizont.net/marketing/nachrichten/globale-kampagne-mit-diesem-beruehrenden-alien-film-kaempft-nivea-gegen-einsamkeit-229137,0,www.horizont.net,Globale Kampagne: Mit diesem berührenden Alien-Film kämpft Nivea gegen Einsamkeit,"Die Pflegemarke Nivea hat ein neues Haltungsthema für sich identifiziert. In der neuen globalen Kampagne geht es nicht um eine politische Positionierung, sondern um die Aufklärung über ein wachsendes gesellschaftliches Problem.",https://www.horizont.net/news/media/48/Nivea-Alien-2025-475584.png,2025-07-14T10:10:00Z,,"Die Pflegemarke Nivea hat ein neues Haltungsthema für sich identifiziert. In der neuen globalen Kampagne geht es nicht um eine politische Positionierung, sondern um die Aufklärung über ein wachsendes… [+406 chars]",,de,'Einsamkeit'
https://www.bild.de/sport/mehr-sport/ski-profi-27-muss-wegen-geld-not-karriere-beenden-emotionaler-post-6874fa4d7310134cfb6298a0,https://www.bild.de/sport/mehr-sport/ski-profi-27-muss-wegen-geld-not-karriere-beenden-emotionaler-post-6874fa4d7310134cfb6298a0,0,www.bild.de,Emotionaler Post - Ski-Profi (27) muss wegen Geld-Not Karriere beenden,Ski-Rennfahrerin Sabrina Wanjiku Simader muss ihre Karriere wegen Geldsorgen beenden.,"https://images.bild.de/6874fa4d7310134cfb6298a0/402fff57ea82a2c33cd71f95f53e90c3,61ed525d?w=1280",2025-07-15T06:27:56Z,https://web.archive.org/web/20250726022943/https://www.bild.de/sport/mehr-sport/ski-profi-27-muss-wegen-geld-not-karriere-beenden-emotionaler-post-6874fa4d7310134cfb6298a0,"Wie bitter!
Afrikas erste professionelle Ski-Rennfahrerin Sabrina Wanjiku Simader (27) hat auf Instagram ihr Karriereende bekanntgegeben. Sie schreibt. Nach 11 prägenden und herzerfüllten Jahren im … [+2831 chars]",,de,'Geldsorgen'
https://www.perlentaucher.de/buecherschau/2025-07-15.html,https://www.perlentaucher.de/buecherschau/2025-07-15.html,0,www.perlentaucher.de,BÜCHERSCHAU DES TAGES: Melancholisches Dandytum mit Räucherstäben,"Die FAZ spürt bei Eli Beneš die Einsamkeit eines Shoah-Überlebenden im Prag der Nachkriegszeit. Der durch New York irrlichternden Heldin aus Marlene Streeruwitz' neuem Buch empfiehlt sie, mal aus der eigenen Bubble rauszukommen. Die taz beschwört mit Sascha E…",https://www.perlentaucher.de/cdata/buecherschau-twitterbild/7790.png,2025-07-15T12:00:00Z,,"Perlentaucher-Fakten
108798
Rezensionsnotizen
66109
Bücher
37535
Buchautoren
Bücherschau des Tages
Melancholisches Dandytum mit Räucherstäben
Notizen zu den Buchkritiken des Tages aus FAZ, F… [+1141 chars]",,de,'Einsamkeit'
https://www.stern.de/news/linke-setzt-angebot--heizkostencheck--bis-zum-jahresende-fort-35897602.html,https://www.stern.de/news/linke-setzt-angebot--heizkostencheck--bis-zum-jahresende-fort-35897602.html,0,www.stern.de,"Linke setzt Angebot ""Heizkostencheck"" bis zum Jahresende fort","Die Linke setzt ihr Angebot eines ""Heizkostenchecks"" für Mieterinnen und Mieter bis zum Jahresende fort. Einen entsprechenden Antrag, die bislang bis Mitte Juli finanzierte Aktion zu verlängern, billigte am Dienstagabend die Parteispitze. ""Die Mieterinnen und…",https://image.stern.de/35897604/t/Ei/v1/w1440/r1.7778/-/16--heizkoerper---8f63a04fa0027f3e.jpg,2025-07-16T03:02:18Z,,"Kopiere den aktuellen Link
Zur Merkliste hinzufügen
Die Linke setzt ihr Angebot eines ""Heizkostenchecks"" für Mieterinnen und Mieter bis zum Jahresende fort. Einen entsprechenden Antrag, die bislang… [+1633 chars]",,de,'Heizkosten'
https://www.tagesspiegel.de/wirtschaft/finanzen/online-hilfe-fur-mieter-linke-fuhrt-angebot-heizkostencheck-bis-zum-jahresende-fort-14031002.html,https://www.tagesspiegel.de/wirtschaft/finanzen/online-hilfe-fur-mieter-linke-fuhrt-angebot-heizkostencheck-bis-zum-jahresende-fort-14031002.html,0,www.tagesspiegel.de,Online-Hilfe für Mieter: Linke führt Angebot „Heizkostencheck“ bis zum Jahresende fort,"Der Service der Partei, um Abrechnungen zu überprüfen, geht weiter. Einen entsprechenden Antrag, die bislang bis Mitte Juli finanzierte Aktion zu verlängern, billigte die Parteispitze.",https://www.tagesspiegel.de/images/13124938/alternates/BASE_16_9_W1400/1752645877000/thermostat-an-einem-heizkorper.jpeg,2025-07-16T06:09:19Z,,"Die Linke setzt ihr Angebot eines Heizkostenchecks für Mieterinnen und Mieter bis zum Jahresende fort. Einen entsprechenden Antrag, die bislang bis Mitte Juli finanzierte Aktion zu verlängern, billig… [+2163 chars]",,de,'Heizkosten'
https://www.stern.de/gesellschaft/regional/sachsen-anhalt/anschlag-in-magdeburg--bau-von-neuem-prozessgebaeude-geht-voran-35898840.html,https://www.stern.de/gesellschaft/regional/sachsen-anhalt/anschlag-in-magdeburg--bau-von-neuem-prozessgebaeude-geht-voran-35898840.html,0,www.stern.de,Anschlag in Magdeburg: Bau von neuem Prozessgebäude geht voran,"Beim Anschlag auf den Magdeburger Weihnachtsmarkt starben sechs Menschen, rund 300 wurden verletzt. Die Ermittlungen laufen noch. Für den Prozess ist bald aber alles vorbereitet.",https://image.stern.de/35898842/t/wI/v1/w1440/r1.7778/-/16--r4szczcxg7v5axs2048jpeg---54252f23c96dbcf3.jpg,2025-07-16T11:03:18Z,,"Kopiere den aktuellen Link
Zur Merkliste hinzufügen
Beim Anschlag auf den Magdeburger Weihnachtsmarkt starben sechs Menschen, rund 300 wurden verletzt. Die Ermittlungen laufen noch. Für den Prozess… [+581 chars]",,de,'Weihnachtsmarkt'
https://www.tagesschau.de/inland/gesellschaft/alleinlebende-100.html,https://www.tagesschau.de/inland/gesellschaft/alleinlebende-100.html,0,www.tagesschau.de,Gut jeder fünfte Mensch in Deutschland lebt allein,Rund 17 Millionen Menschen in Deutschland leben allein - das sind deutlich mehr als vor 20 Jahren und auch deutlich mehr als in anderen EU-Ländern. Alleinlebende sind in höherem Maße von Einsamkeit und Armut betroffen.,https://images.tagesschau.de/image/c733ecb5-0511-4bd8-b4b1-db1ac592678a/AAABmBOIjpc/AAABkZLlo-k/16x9-big/alleinlebend-100.jpg?width=1280,2025-07-16T13:59:33Z,,"Stand: 16.07.2025 15:59 Uhr
Rund 17 Millionen Menschen in Deutschland leben allein - rund 17 Prozent mehr als vor 20 Jahren. Sie sind in höherem Maße von Einsamkeit und Armut betroffen. 
In Deutsch… [+4590 chars]",,de,'Einsamkeit'
https://www.tagesspiegel.de/sport/wintersport-er-holte-olympia-bronze-skicrosser-stirbt-nach-blitzschlag-14036156.html,https://www.tagesspiegel.de/sport/wintersport-er-holte-olympia-bronze-skicrosser-stirbt-nach-blitzschlag-14036156.html,0,www.tagesspiegel.de,Wintersport: Er holte Olympia-Bronze: Skicrosser stirbt nach Blitzschlag,"Der ehemalige Skicrosser Audun Grönvold macht eine Hüttentour, als er vom Blitz getroffen wird. Der Norweger stirbt an den Verletzungen. Seinen größten sportlichen Erfolg feiert er bei Olympia 2010.",https://www.tagesspiegel.de/images/14036153/alternates/BASE_16_9_W1400/1752678793000/audun-gronvold.jpeg,2025-07-16T15:13:13Z,,Die Wintersportwelt trauert um den ehemaligen Skicrosser Audun Grönvold. Der Bronzemedaillengewinner der Olympischen Spiele 2010 in Vancouver wurde während einer Hüttentour vom Blitz getroffen und st… [+1138 chars],,de,'Wintersport'
https://www.bild.de/politik/inland/islamist-feiert-magdeburg-attentat-interview-schockiert-6878cada6ea2c1003f007b94,https://www.bild.de/politik/inland/islamist-feiert-magdeburg-attentat-interview-schockiert-6878cada6ea2c1003f007b94,0,www.bild.de,Hass vor laufender Kamera - Ahmad A. lobt Weihnachtsmarkt-Attentat,"Ahmad A. lacht über den Terroranschlag auf dem Weihnachtsmarkt in Magdeburg. MDR-Journalisten informieren die Polizei, doch Ahmad A. ist untergetaucht.","https://images.bild.de/6878cada6ea2c1003f007b94/9342f55d59509e87296d87a6f6d35907,7264e0b9?w=1280",2025-07-17T12:51:26Z,,"Magdeburg Er lacht ins Mikrofon. Er spricht über den Terroranschlag von Magdeburg und sagt unverhohlen: Schade, dass nicht mehr Menschen gestorben sind.
Ein Islamist freut sich im Interview mit eine… [+2693 chars]",,de,'Weihnachtsmarkt'
https://www.faz.net/aktuell/feuilleton/buecher/literatur/prag-nach-der-schoa-eli-bene-und-sein-romandebuet-110589932.html,https://www.faz.net/aktuell/feuilleton/buecher/literatur/prag-nach-der-schoa-eli-bene-und-sein-romandebuet-110589932.html,0,www.faz.net,Prag nach der Schoa: Eli Beneš und sein Romandebüt „Unmerklicher Verlust der Einsamkeit“,Eli Beneš war zunächst Radiomoderator und komponierte Musik für das tschechische Fernsehen. In seinem Debütroman „Unmerklicher Verlust der Einsamkeit“ erzählt er vom Leben in Prag nach der Schoa.,https://media0.faz.net/ppmedia/aktuell/3410102649/1.10589930/facebook_teaser_fplus/ungefaehr-80-000-namen-auf-den.jpg,2025-07-17T14:55:07Z,,"Das Leben geht weiter. Manchmal humpelt es bloß oder kriecht gar, aufhalten aber lässt es sich nicht. Petr Stein kehrt aus dem KZ Auschwitz in das gerade von den Deutschen geräumte Prag zurück und er… [+626 chars]",,de,'Einsamkeit'
https://www.stern.de/panorama/naturgefahren--nach-felssturz--zugang-zu-staumauer-in-der-schweiz-gesperrt-35903134.html,https://www.stern.de/panorama/naturgefahren--nach-felssturz--zugang-zu-staumauer-in-der-schweiz-gesperrt-35903134.html,0,www.stern.de,Naturgefahren: Nach Felssturz: Zugang zu Staumauer in der Schweiz gesperrt,"Es ist eine Touristenattraktion, die 285 Meter hohe Staumauer Grande Dixence im Kanton Wallis. Seit dem Wochenende bröckeln dort Felsen. Jetzt ergreifen die Behörden Vorsichtsmaßnahmen.",https://image.stern.de/35903136/t/Gf/v1/w1440/r1.7778/-/17--zrv6dbfpnuv5axs2048jpeg---a298d5682222d4e4.jpg,2025-07-17T16:17:17Z,,"Kopiere den aktuellen Link
Zur Merkliste hinzufügen
Es ist eine Touristenattraktion, die 285 Meter hohe Staumauer Grande Dixence im Kanton Wallis. Seit dem Wochenende bröckeln dort Felsen. Jetzt er… [+1611 chars]",,de,'Vorsichtsmaßnahmen'
https://www.tagesspiegel.de/gesellschaft/panorama/naturgefahren-nach-felssturz-zugang-zu-staumauer-in-der-schweiz-gesperrt-14043719.html,https://www.tagesspiegel.de/gesellschaft/panorama/naturgefahren-nach-felssturz-zugang-zu-staumauer-in-der-schweiz-gesperrt-14043719.html,0,www.tagesspiegel.de,Naturgefahren: Nach Felssturz: Zugang zu Staumauer in der Schweiz gesperrt,"Es ist eine Touristenattraktion, die 285 Meter hohe Staumauer Grande Dixence im Kanton Wallis. Seit dem Wochenende bröckeln dort Felsen. Jetzt ergreifen die Behörden Vorsichtsmaßnahmen.",https://www.tagesspiegel.de/images/14043716/alternates/BASE_16_9_W1400/1752769116000/felssturz-nahe-staudamm-grand-dixence-im-schweizer-wallis.jpeg,2025-07-17T16:18:36Z,,"Nach einem Felssturz nahe einer Staumauer im Schweizer Ferienkanton Wallis haben die Behörden eine Zugangsstraße für jeglichen Verkehr geschlossen, auch Fußgänger. Gefahr für die Staumauer Grande Dix… [+1466 chars]",,de,'Vorsichtsmaßnahmen'
https://www.n-tv.de/leute/Gavin-Rossdale-will-mit-Bush-die-Einsamkeit-besiegen-article25907868.html,https://www.n-tv.de/leute/Gavin-Rossdale-will-mit-Bush-die-Einsamkeit-besiegen-article25907868.html,0,www.n-tv.de,Neues Album statt Greatest Hits: Gavin Rossdale will mit Bush die Einsamkeit besiegen,"Über 30 Jahre sind vergangen, seit sich Bush um Frontmann Gavin Rossdale gegründet haben. Doch der Sänger will sich nicht auf seine Hits von anno dunnemals beschränken lassen. Nun legen er und seine Formation ihr neues Album ""I Beat Loneliness"" vor.",https://www.n-tv.de/img/incoming/crop25907869/3531329314-cImg_16_9-w1200/BUSH-I-Beat-Loneliness-press-pictures-copyright-earMUSIC-credit-Chapman-Baehler-9.jpg,2025-07-18T08:32:28Z,,"Über 30 Jahre sind vergangen, seit sich Bush um Frontmann Gavin Rossdale gegründet haben. Doch der Sänger will sich nicht auf seine Hits von anno dunnemals beschränken lassen. Nun legen er und seine … [+3294 chars]",,de,'Einsamkeit'
https://www.stern.de/gesellschaft/alleinlebende-in-deutschland--soziologin-erklaert--warum-35905410.html,https://www.stern.de/gesellschaft/alleinlebende-in-deutschland--soziologin-erklaert--warum-35905410.html,0,www.stern.de,"Interview: ""Die meisten Alleinlebenden sind weder allein noch einsam""",Die Zahl der Alleinlebenden in Deutschland wächst stetig. Wird Einsamkeit künftig ein immer größeres Problem für die Gesellschaft? Soziologin Claudia Neu gibt Antworten.,https://image.stern.de/6681672/t/Un/v7/w1440/r1.7778/-/video-fallback-image.png,2025-07-18T13:12:05Z,,"Kopiere den aktuellen Link
Zur Merkliste hinzufügen
Die Zahl der Alleinlebenden in Deutschland wächst stetig. Wird Einsamkeit künftig ein immer größeres Problem für die Gesellschaft? Soziologin Cla… [+4951 chars]",,de,'Einsamkeit'
https://www.sueddeutsche.de/gesundheit/depressionen-alter-wolfgang-grupps-appell-hilfe-li.3286330,https://www.sueddeutsche.de/gesundheit/depressionen-alter-wolfgang-grupps-appell-hilfe-li.3286330,0,www.sueddeutsche.de,Altersdepression: „Wir müssen mehr darüber reden“,"Wolfgang Grupp thematisiert in einem Brief seine Altersdepression und ermutigt zur Suche nach Hilfe. Studien zeigen, dass viele ältere Menschen betroffen sind. Einsamkeit, fehlende Aufgaben und falsche Ernährung spielen eine Rolle.",https://www.sueddeutsche.de/2025/07/18/770f3676-e90d-4a38-a414-83e39f7250df.jpg?q=60&fm=webp&width=1200&rect=0%2C1250%2C2667%2C1500,2025-07-18T13:52:11Z,,"18. Juli 2025, 15:52 Uhr|Lesezeit: 4 Min.
|
Der 83-jährige Ex-Trigema-Chef Wolfgang Grupp hat öffentlich gemacht, dass er unter Altersdepressionen leidet. Diese Krankheit sei verbreitet, sagt der G… [+643 chars]",,de,'Einsamkeit'
https://www.nzz.ch/gesellschaft/die-geschichte-von-der-grossmutter-die-mit-80-zu-lesen-begann-der-einsamkeit-entkam-die-welt-bereiste-und-beruehmt-wurde-ohne-dass-sie-es-ganz-verstand-ld.1887764,https://www.nzz.ch/gesellschaft/die-geschichte-von-der-grossmutter-die-mit-80-zu-lesen-begann-der-einsamkeit-entkam-die-welt-bereiste-und-beruehmt-wurde-ohne-dass-sie-es-ganz-verstand-ld.1887764,0,www.nzz.ch,"Die Geschichte von der Grossmutter, die mit 80 zu lesen begann, der Einsamkeit entkam, die Welt bereiste und berühmt wurde, ohne dass sie es ganz verstand","Ich hatte eine Geschichte gelesen, die in der heutigen Zeit so schön und hoffnungsvoll und traurig klang, dass sie nur ein Märchen sein konnte. Vielleicht war sie nicht wahr, aber ich wusste: Ich muss die Grossmutter finden.","https://img.nzz.ch/2025/07/14/227f4646-7bd8-49b2-96a4-175dd6e0249b.jpeg?width=1200&height=675&fit=bounds&quality=75&auto=webp&crop=9504,5346,x0,y582&wmark=nzz",2025-07-19T03:35:00Z,,"Die Grossmutter I
Auf dem Tisch liegen Teller und Schüsseln, gefüllt mit Fleischbällchen, Oliven, Käse. «Esst! Esst!», befiehlt uns die alte Frau, die auf der Bank sitzt. «Wieso essen sie nicht mehr… [+23695 chars]",,de,'Einsamkeit'
https://vorarlberg.orf.at/stories/3314173/,https://vorarlberg.orf.at/stories/3314173/,0,vorarlberg.orf.at,Über 37.500 Menschen suchten Rat bei ifs,"Finanzielle Sorgen, Einsamkeit, psychische Belastungen: Der Alltag stellt viele vor große Herausforderungen. Über 37.500 Personen suchten   im Vorjahr  Hilfe beim Institut für Sozialdienste (ifs). „Ein deutlicher Hinweis darauf, wie dringend das psychosoziale…",https://ibs.orf.at/vbg?image=https%3A%2F%2Foekastatic.orf.at%2Fmims%2F2019%2F46%2F87%2Fcrops%2Fw%3D1200%2Ch%3D627%2Cq%3D75%2F369587_master_119387_adobestock_149171725.jpeg%3Fs%3Ddf7633cee7c70f2b6e865b3195427b71d5a25855,2025-07-19T06:49:30Z,,"57 Prozent der Klienten waren Frauen. Laut Angaben des ifs suchten vor allem Personen im Alter zwischen 35 und 44 Jahren nach Hilfe und Rat. Insgesamt waren es 24,1 Prozent. Mit 19,6 Prozent waren Pe… [+1700 chars]",,de,'Einsamkeit'
https://www.diepresse.com/19914570/schwerer-cyberangriff-auf-singapur-bedroht-wichtige-infrastruktur,https://www.diepresse.com/19914570/schwerer-cyberangriff-auf-singapur-bedroht-wichtige-infrastruktur,0,www.diepresse.com,Schwerer Cyberangriff auf Singapur bedroht wichtige Infrastruktur,"Der Sicherheitsminister von Singapur warnt vor schweren Störungen und der Gefahr von Spionage, sollte der Angriff gelingen. Er beschuldigt China, hinter der Cyberattacke zu stecken.",https://img.diepresse.com/public/incoming/p5l8hv-FILES-SINGAPORE-AUSTRALIA-ENERGY-CLIMATE/alternates/DPR_SOCIAL_NACHRICHTEN/FILES-SINGAPORE-AUSTRALIA-ENERGY-CLIMATE,2025-07-19T07:43:51Z,,"Der Sicherheitsminister von Singapur warnt vor schweren Störungen und der Gefahr von Spionage, sollte der Angriff gelingen. Er beschuldigt China, hinter der Cyberattacke zu stecken.",,de,'Infrastruktur Gefahr'
