index,url,valid,domain,title,description,image,published,archive,content,quote,language,keyword
https://www.zeit.de/news/2025-02/01/angebot-an-skikursen-durch-schneemangel-begrenzt,https://www.zeit.de/news/2025-02/01/angebot-an-skikursen-durch-schneemangel-begrenzt,0,www.zeit.de,Wintersport: Angebot an Skikursen durch Schneemangel begrenzt,Hier finden Sie Informationen zu dem Thema „Wintersport“. Lesen Sie jetzt „Angebot an Skikursen durch Schneemangel begrenzt“.,https://img.zeit.de/news/2025-02/01/angebot-an-skikursen-durch-schneemangel-begrenzt-image-group/wide__1300x731,2025-02-01T04:00:36Z,,"Der Schneemangel im Thüringer Wald lässt in diesem Winter nur begrenzt Skikurse für Touristen und Einheimische zu. Am ehesten ist dies noch in Oberhof möglich, wie Anbieter von Langlauf- und Alpinski… [+2142 chars]",,de,'Wintersport'
https://www.stern.de/gesellschaft/regional/thueringen/wintersport--angebot-an-skikursen-durch-schneemangel-begrenzt-35431150.html,https://www.stern.de/gesellschaft/regional/thueringen/wintersport--angebot-an-skikursen-durch-schneemangel-begrenzt-35431150.html,0,www.stern.de,Wintersport: Angebot an Skikursen durch Schneemangel begrenzt,Kurse für Skianfänger sind für Sportfachgeschäfte in Wintersportgebieten ein wichtiger Umsatzfaktor. Bei Schneemangel müssen sie sich etwas einfallen lassen.,https://image.stern.de/35431152/t/5T/v1/w1440/r1.7778/-/01--cuseryomk6v16axs2048jpeg---f7107a9839cc1280.jpg,2025-02-01T04:00:36Z,,"Kopiere den aktuellen Link
Kurse für Skianfänger sind für Sportfachgeschäfte in Wintersportgebieten ein wichtiger Umsatzfaktor. Bei Schneemangel müssen sie sich etwas einfallen lassen.
Der Schneema… [+2289 chars]",,de,'Wintersport'
https://www.dwdl.de/zahlenzentrale/101302/sport_pusht_ard_und_zdf_dschungel_bringt_rtl_wieder_auf_kurs/,https://www.dwdl.de/zahlenzentrale/101302/sport_pusht_ard_und_zdf_dschungel_bringt_rtl_wieder_auf_kurs/,0,www.dwdl.de,"Sport pusht ARD und ZDF, Dschungel bringt RTL wieder auf Kurs","Der Januar lief u.a. dank Handball und Wintersport für das ZDF und Das Erste wieder prächtig, RTL kehrte nach drei schwachen Monaten in die Zweistelligkeit zurück - blieb aber unter den Vorjahreswerten. Deutlich besser als 2024 startete ProSieben ins Jahr.",https://www.dwdl.de/images/1599057868_quoten.jpg,2025-02-01T09:15:00Z,,"RTL feierte im vergangenen Jahr, dass man als einziger der großen Privatsender in einem großen Sportjahr Marktanteile hinzugewinnen konnte - allerdings gehört zur Wahrheit auch, dass es im Herbst für… [+8217 chars]",,de,'Wintersport'
