index,url,valid,domain,title,description,image,published,archive,content,quote,language,keyword
https://www.derstandard.at/story/2000140247420/the-cure-in-wien-einsamkeit-als-kollektives-gluecksgefuehl,https://www.derstandard.at/story/2000140247420/the-cure-in-wien-einsamkeit-als-kollektives-gluecksgefuehl,0,www.derstandard.at,The Cure in Wien: Einsamkeit als kollektives Glücksgefühl - DER STANDARD,"Robert Smith begeisterte in der Marx-Halle mit einem epischen Konzert, das kaum Wünsche offenließ",https://i.ds.at/zMh6pg/rs:fill:1200:600/plain/2022/10/24/Robert.jpeg,2022-10-24T09:59:00Z,,"Sie entscheiden darüber, wie Sie unsere Inhalte nutzen wollen. Ihr Gerät erlaubt uns derzeit leider nicht, die entsprechenden Optionen anzuzeigen.
Bitte deaktivieren Sie sämtliche Hard- und Software… [+180 chars]",,de,'Einsamkeit'
https://www.spektrum.de/news/schlechter-schlaf-und-einsamkeit-haengen-zusammen/2070042,https://www.spektrum.de/news/schlechter-schlaf-und-einsamkeit-haengen-zusammen/2070042,0,www.spektrum.de,Interview: »Unausgeschlafene Menschen sind weniger bereit zu helfen«,"Wer Schlafstörungen hat, verhält sich weniger sozial: Die Empathie sinkt, die Einsamkeit steigt. Andere können das spüren, erklärt Hirnforscherin Eti Ben Simon im Interview.",https://static.spektrum.de/fm/912/f1920x1080/iStock-821634668.jpg,2022-10-26T06:10:29Z,http://archive.md/20221103121750/https://www.spektrum.de/news/schlechter-schlaf-und-einsamkeit-haengen-zusammen/2070042,"»Mit unausgeschlafenen Menschen wollen andere weniger gern zu tun haben«
Sie haben außerdem festgestellt, dass sich die Schlaflosigkeit einer Person auf die Menschen um sie herum auswirkt. Wie kommt… [+2286 chars]",,de,'Einsamkeit'
https://www.diepresse.com/6209134/pandemie-der-einsamkeit,https://www.diepresse.com/6209134/pandemie-der-einsamkeit,0,www.diepresse.com,Pandemie der Einsamkeit [premium],"US-Amerikaner waren schon vor Corona äußerst einsam, junge Menschen dabei wesentlich öfter als andere. Mittlerweile sogar (fast) freiwillig. Woran liegt das?",https://media.diepresse.com/social_diepresse_magazin_paid/images/uploads_1200/e/6/e/6209134/Sunset-in-New-York-City_1667056748810216.jpg,2022-10-30T14:14:00Z,,"US-Amerikaner waren schon vor Corona äußerst einsam, junge Menschen dabei wesentlich öfter als andere. Mittlerweile sogar (fast) freiwillig. Woran liegt das?
Es ist Freitagabend in Manhattan: Die So… [+630 chars]",,de,'Einsamkeit'
