index,url,valid,domain,title,description,image,published,archive,content,quote,language,keyword
https://www.stern.de/gesellschaft/regional/bayern/klimawandel--schmelzender-pistenspass--bald-schwimmlager-statt-skilager--35601378.html,https://www.stern.de/gesellschaft/regional/bayern/klimawandel--schmelzender-pistenspass--bald-schwimmlager-statt-skilager--35601378.html,0,www.stern.de,Klimawandel: Schmelzender Pistenspaß: Bald Schwimmlager statt Skilager?,Der Schnee schmilzt - und mit ihm die Chance auf Wintersport. Sollen Kinder überhaupt noch Ski- und Snowboardfahren lernen? Und sollten Schulklassen weiter ins Skilager fahren?,https://image.stern.de/35601380/t/9A/v1/w1440/r1.7778/-/01--nkrwv6lizzv1axs2048jpeg---5fbb062d5ac49111.jpg,2025-04-01T02:30:37Z,https://web.archive.org/web/20250402155315/https://www.stern.de/gesellschaft/regional/bayern/klimawandel--schmelzender-pistenspass--bald-schwimmlager-statt-skilager--35601378.html,"Kopiere den aktuellen Link
Zur Merkliste hinzufügen
Der Schnee schmilzt - und mit ihm die Chance auf Wintersport. Sollen Kinder überhaupt noch Ski- und Snowboardfahren lernen? Und sollten Schulklas… [+3480 chars]",,de,'Wintersport'
https://www.stern.de/gesellschaft/regional/sachsen-anhalt/nach-magdeburg-anschlag--opferhilfefonds-mit-weniger-wenn-und-aber-35603324.html,https://www.stern.de/gesellschaft/regional/sachsen-anhalt/nach-magdeburg-anschlag--opferhilfefonds-mit-weniger-wenn-und-aber-35603324.html,0,www.stern.de,Nach Magdeburg-Anschlag: Opferhilfefonds mit weniger Wenn und Aber,Magdeburg (sa) - Die Betroffenen des Anschlags auf dem Magdeburger Weihnachtsmarkt sollen ohne großes Wenn und Aber Geld aus dem Opferhilfefonds des,https://image.stern.de/35603326/t/6o/v1/w1440/r1.7778/-/01--ra7kwwxmmiv5axs2048jpeg---2ae783bf3a376ff1.jpg,2025-04-01T12:33:22Z,https://web.archive.org/web/20250401130323/https://www.stern.de/gesellschaft/regional/sachsen-anhalt/nach-magdeburg-anschlag--opferhilfefonds-mit-weniger-wenn-und-aber-35603324.html,"Kopiere den aktuellen Link
Zur Merkliste hinzufügen
Opfern schwerer Gewalttaten landesweiter Bedeutung lässt Sachsen-Anhalt besondere Hilfen zukommen. Eine Einschränkung wird jetzt gestrichen.
Die… [+1990 chars]",,de,'Weihnachtsmarkt'
https://www.focus.de/wetter/sommerwetter-in-deutschland-am-donnerstag-sind-hier-bis-zu-23-grad-drin_a9c06b4a-b8d2-4e7a-9ddb-dd327b8cc3ec.html,https://www.focus.de/wetter/sommerwetter-in-deutschland-am-donnerstag-sind-hier-bis-zu-23-grad-drin_a9c06b4a-b8d2-4e7a-9ddb-dd327b8cc3ec.html,0,www.focus.de,"Erst warm, dann kalt - Sommerwetter in Deutschland: am Donnerstag sind hier bis zu 24 Grad drin",Hoch Naomi bringt Wärme. Das Wetter in Deutschland könnte am Freitag fast sommerliche Temperaturen erreichen. Ein Kälteeinbruch am Wochenende ist jedoch vorhergesagt.Von FOCUS-online-Autor Matthias Kernstock (München),https://quadro.burda-forward.de/ctf/232cddbe-bbb3-48a1-a9f8-ca4e53a415a0.38c3cc9f-cc4a-4c34-a4af-919870b11a16.jpg?im=RegionOfInterestCrop%3D%281200%2C630%29%2CregionOfInterest%3D%28963%2C353%29&hash=f8ab831d1f0b14ba17d7e95c0abb8443dcab42f658198904deadc6d3a42793e7,2025-04-02T05:10:00Z,,Jetzt kommt Sommerwetter nach Deutschland. Ein neues Hochdruckgebiet namens Naomi breitet sich von Westen her aus und könnte insbesondere am Freitag die Temperaturen in Deutschland in die Nähe der 25… [+2232 chars],,de,'Kälteeinbruch'
https://www.bild.de/regional/magdeburg/anschlag-in-magdeburg-erstes-gutachten-zu-amok-auto-liegt-vor-67ecd00813dc1603fc0c1e63,https://www.bild.de/regional/magdeburg/anschlag-in-magdeburg-erstes-gutachten-zu-amok-auto-liegt-vor-67ecd00813dc1603fc0c1e63,0,www.bild.de,Anschlag auf Weihnachtsmarkt in Magdeburg - Notbremse manipuliert? Gutachten zu Amok-Auto da,"In dem Gutachten zum BMW X3, der bei der Todesfahrt über den Magdeburger Weihnachtsmarkt zum Einsatz kam, wurden mögliche Manipulationen geprüft.","https://images.bild.de/67ecd00813dc1603fc0c1e63/5496165652a2d895dea8fee0b7d15ef3,27173d93?w=1280",2025-04-02T09:34:28Z,,"Magdeburg Bei seiner Todesfahrt über den Magdeburger Weihnachtsmarkt tötete Taleb A. sechs Menschen, darunter einen neunjährigen Jungen. Für seine Tat hatte er einen Leihwagen missbraucht. Schnell en… [+1860 chars]",,de,'Weihnachtsmarkt'
https://www.stern.de/panorama/schmelzende-pisten--bald-keine-skilager-mehr-fuer-schulklassen--35601378.html,https://www.stern.de/panorama/schmelzende-pisten--bald-keine-skilager-mehr-fuer-schulklassen--35601378.html,0,www.stern.de,Klimawandel: Schmelzende Pisten: Bald keine Skilager mehr für Schulklassen?,"Die Temperaturen steigen, der Schnee schmilzt – und mit ihm die Chance aufs Skifahren. An Schulen wird diskutiert, ob Kinder überhaupt noch Wintersport lernen sollen.",https://image.stern.de/35605816/t/5B/v2/w1440/r1.7778/-/kinder-ski.jpg,2025-04-02T10:16:00Z,,"Kopiere den aktuellen Link
Zur Merkliste hinzufügen
Die Temperaturen steigen, der Schnee schmilzt und mit ihm die Chance aufs Skifahren. An Schulen wird diskutiert, ob Kinder überhaupt noch Winters… [+3313 chars]",,de,'Wintersport'
https://www.nzz.ch/zuerich/news-aus-zuerich-stadtrat-zahlt-dieses-jahr-keinen-zustupf-an-die-heizkosten-ld.1871406,https://www.nzz.ch/zuerich/news-aus-zuerich-stadtrat-zahlt-dieses-jahr-keinen-zustupf-an-die-heizkosten-ld.1871406,0,www.nzz.ch,KURZMELDUNGEN - News aus Zürich: Stadtrat zahlt dieses Jahr keinen Zustupf an die Heizkosten,"NZZ Nachrichten, Hintergründe, Meinungen aus der Schweiz, International, Sport, Digital, Wirtschaft, Auto & mehr. Fundierte Berichterstattung rund um die Uhr.","https://img.nzz.ch/2022/11/09/942119b4-8f01-4f91-9567-d76141ace295.jpeg?width=1200&height=675&fit=bounds&quality=75&auto=webp&crop=7008,3942,x0,y365&wmark=nzz",2025-04-02T13:19:14Z,https://web.archive.org/web/20250402155104/https://www.nzz.ch/zuerich/news-aus-zuerich-stadtrat-zahlt-dieses-jahr-keinen-zustupf-an-die-heizkosten-ld.1871406,"Heizkosten-Zulage wird dieses Jahr nicht ausgezahlt
Für die aktuelle Heizperiode können einkommensschwache Haushalte keinen Beitrag bei der Stadt einfordern.
heu. Die Stadt Zürich hat im Jahr 2023 … [+55228 chars]",,de,'Heizkosten'
https://www.stern.de/gesellschaft/regional/thueringen/sicherheit--erhoehte-sicherheit-zum-thueringentag-in-gotha-35610332.html,https://www.stern.de/gesellschaft/regional/thueringen/sicherheit--erhoehte-sicherheit-zum-thueringentag-in-gotha-35610332.html,0,www.stern.de,Sicherheit: Erhöhte Sicherheit zum Thüringentag in Gotha,Nach den jüngsten Anschlägen auf dem Weihnachtsmarkt in Magdeburg sowie bei einer Demonstration in München trifft Gotha für den Thüringentag Vorkehrungen. Es gibt ein umfassendes Sicherungskonzept.,https://image.stern.de/35610334/t/uL/v1/w1440/r1.7778/-/03--3xiq73dsaiv4axs2048jpeg---72af8c9daad7b091.jpg,2025-04-03T13:16:41Z,,"Kopiere den aktuellen Link
Zur Merkliste hinzufügen
Nach den jüngsten Anschlägen auf dem Weihnachtsmarkt in Magdeburg sowie bei einer Demonstration in München trifft Gotha für den Thüringentag Vork… [+1727 chars]",,de,'Weihnachtsmarkt'
https://www.brigitte.de/leben/muede-nach-zeitumstellung--medizin-professorin-verraet-3-tipps-gegen-den-mini-jetlag-13970086.html,https://www.brigitte.de/leben/muede-nach-zeitumstellung--medizin-professorin-verraet-3-tipps-gegen-den-mini-jetlag-13970086.html,0,www.brigitte.de,Laut Medizin-Professorin: Mit diesen 3 Tipps besiegst du den Mini-Jetlag nach der Zeitumstellung,"Bist du auch noch von der Zeitumstellung geplagt und fühlst dich müder als sonst? Keine Sorge! Wir verraten dir drei einfache Tipps, mit denen du den Mini-Jetlag im Handumdrehen loswirst.",https://image.brigitte.de/13970076/t/Tr/v1/w1440/r1.7778/-/zeitumstellung-mit-diesen-drei-tipps-besiegst-du-den-mini-jetlag.jpg,2025-04-04T04:00:00Z,,"Bist du auch noch von der Zeitumstellung geplagt und fühlst dich müder als sonst? Keine Sorge! Wir verraten dir drei einfache Tipps, mit denen du den Mini-Jetlag im Handumdrehen loswirst.
In der Nac… [+674 chars]",,de,'Zeitumstellung'
https://www.zeit.de/news/2025-04/04/viele-aerzte-bei-magdeburg-anschlag-vor-ort,https://www.zeit.de/news/2025-04/04/viele-aerzte-bei-magdeburg-anschlag-vor-ort,0,www.zeit.de,Anschlag auf Weihnachtsmarkt: Viele Ärzte bei Magdeburg-Anschlag vor Ort,Hier finden Sie Informationen zu dem Thema „Anschlag auf Weihnachtsmarkt“. Lesen Sie jetzt „Viele Ärzte bei Magdeburg-Anschlag vor Ort“.,https://img.zeit.de/news/2025-04/04/viele-aerzte-bei-magdeburg-anschlag-vor-ort-image-group/wide__1300x731,2025-04-04T11:28:50Z,,"Beim Anschlag auf den Weihnachtsmarkt sind die Rettungskräfte von vielen Ersthelfern und Ärzten unterstützt worden, die privat vor Ort waren. Es seien an dem Abend mindestens 74 Ärzte an der Einsatzs… [+2393 chars]",,de,'Weihnachtsmarkt'
https://www.zeit.de/news/2025-04/04/magdeburger-weihnachtsmarkt-soll-am-selben-ort-stattfinden,https://www.zeit.de/news/2025-04/04/magdeburger-weihnachtsmarkt-soll-am-selben-ort-stattfinden,0,www.zeit.de,Nach Anschlag: Magdeburger Weihnachtsmarkt soll am selben Ort stattfinden,Hier finden Sie Informationen zu dem Thema „Nach Anschlag“. Lesen Sie jetzt „Magdeburger Weihnachtsmarkt soll am selben Ort stattfinden“.,https://img.zeit.de/news/2025-04/04/magdeburger-weihnachtsmarkt-soll-am-selben-ort-stattfinden-image-group/wide__1300x731,2025-04-04T14:06:46Z,,Nach dem Anschlag auf den Magdeburger Weihnachtsmarkt im vergangenen Jahr soll die Veranstaltung auch in diesem Jahr wieder am selben Ort stattfinden. Der Stadtrat der Landeshauptstadt von Sachsen-An… [+948 chars],,de,'Weihnachtsmarkt'
https://www.stern.de/fotografie/gregory-crewdson--seine-fotos-zeigen-den-amerikanischen-alltag-voller-abgruende-35463082.html,https://www.stern.de/fotografie/gregory-crewdson--seine-fotos-zeigen-den-amerikanischen-alltag-voller-abgruende-35463082.html,0,www.stern.de,Fotografie: Amerikanischer Alltag voller Abgründe,"Der US-Amerikaner Gregory Crewdson inszeniert seit den 80er-Jahren poetische Fotografien. Sie erzählen von Einsamkeit und Isolation, von Sehnsucht und Traurigkeit.",https://image.stern.de/35462912/t/WC/v4/w1440/r1.7778/-/gregory-crewdson-untitled-from-the-series-twilight-1998-2002-c-gregory-crewdson.jpg,2025-04-04T14:33:00Z,,"Kopiere den aktuellen Link
Zur Merkliste hinzufügen
Der US-Amerikaner Gregory Crewdson inszeniert seit den 80er-Jahren poetische Fotografien. Sie erzählen von Einsamkeit und Isolation, von Sehnsuch… [+2182 chars]",,de,'Einsamkeit'
https://www.stern.de/gesellschaft/regional/sachsen-anhalt/anschlag-auf-weihnachtsmarkt--mehr-als-600-einsatzkraefte-bei-magdeburg-anschlag-vor-ort-35612984.html,https://www.stern.de/gesellschaft/regional/sachsen-anhalt/anschlag-auf-weihnachtsmarkt--mehr-als-600-einsatzkraefte-bei-magdeburg-anschlag-vor-ort-35612984.html,0,www.stern.de,Anschlag auf Weihnachtsmarkt: Mehr als 600 Einsatzkräfte bei Magdeburg-Anschlag vor Ort,"Wie erlebten Einsatzkräfte und Ärzte den Anschlag auf den Weihnachtsmarkt in Magdeburg? Im Untersuchungsausschuss wird von ""zahlreichen glücklichen Umständen"" in einer schwierigen Lage berichtet.",https://image.stern.de/35613444/t/Ws/v2/w1440/r1.7778/-/04--jhnggfbdvmv1axs2048jpeg---3ebda783d0738018.jpg,2025-04-04T14:50:22Z,,"Kopiere den aktuellen Link
Zur Merkliste hinzufügen
Wie erlebten Einsatzkräfte und Ärzte den Anschlag auf den Weihnachtsmarkt in Magdeburg? Im Untersuchungsausschuss wird von ""zahlreichen glücklich… [+3370 chars]",,de,'Weihnachtsmarkt'
https://tirol.orf.at/stories/3299920/,https://tirol.orf.at/stories/3299920/,0,tirol.orf.at,Großbaustelle am Innsbrucker Südring,In Innsbruck hat ein umfangreiches Bauprojekt zur Modernisierung der Verkehrsinfrastruktur auf der Innsbrucker Straße (B 174) zwischen der Grassmayrkreuzung und dem Westbahnhof begonnen. Die Arbeiten dauern bis Herbst 2026 und bringen Einschränkungen für den …,https://ibs.orf.at/tir?image=https%3A%2F%2Foekastatic.orf.at%2Fmims%2F2025%2F14%2F11%2Fcrops%2Fw%3D1200%2Ch%3D627%2Cq%3D75%2F2578271_master_989111_dsc_0562.jpeg%3Fs%3D6733a3dc583409f2dbac1ad089beb4d540217fe4,2025-04-05T04:09:40Z,https://web.archive.org/web/20250405071952/https://tirol.orf.at/stories/3299920/,Es ist eines der größten Bauprojekte in Innsbruck in diesem Jahr. Die Innsbrucker Verkehrsbetriebe (IVB) erneuern auf 475 Metern Länge die Bahntrasse und die Haltestelle Cineplexx. Die Innsbrucker Ko… [+2457 chars],,de,'Verkehrsinfrastruktur'
https://www.zeit.de/hamburg/2025-03/einsamkeit-im-alter-gesellschaft-problem-ruhestand,https://www.zeit.de/hamburg/2025-03/einsamkeit-im-alter-gesellschaft-problem-ruhestand,0,www.zeit.de,"Einsamkeit im Alter: ""Die Kassiererinnen waren jahrelang mein einziger Kontakt""",Was hilft gegen Einsamkeit im Alter? Rolf sittet einen Hund und Sieglinde geht in die Disko. Zwei ältere Menschen erzählen.,https://img.zeit.de/hamburg/2025-04/einsamkeit-im-alter/wide__1300x731,2025-04-05T07:47:56Z,http://archive.md/20250405080713/https://www.zeit.de/hamburg/2025-03/einsamkeit-im-alter-gesellschaft-problem-ruhestand,"Es ist Frühling, die Stadt erwacht zum Leben, die Menschen strömen nach draußen. Doch was, wenn man niemanden hat, der einen begleitet, nie? Gerade unter älteren Menschen in der Großstadt ist Einsamk… [+721 chars]",,de,'Einsamkeit'
https://www.diepresse.com/19553946/unserer-kuechenuhr-geht-es-wie-den-zirkustieren,https://www.diepresse.com/19553946/unserer-kuechenuhr-geht-es-wie-den-zirkustieren,0,www.diepresse.com,Unserer Küchenuhr geht es wie den Zirkustieren,"Eines Tages werden sich Menschen darüber wundern, dass es so etwas wie die Zeitumstellung gegeben hat.",https://img.diepresse.com/public/incoming/e5piab-Floriant_DSC6169_1620372949541651_1623409500238766_1624275176566536_1625060226232909.jpg/alternates/DPR_SOCIAL_MEINUNG/Floriant_DSC6169_1620372949541651_1623409500238766_1624275176566536_1625060226232909.jpg,2025-04-07T07:52:26Z,,"Eines Tages werden sich Menschen darüber wundern, dass es so etwas wie die Zeitumstellung gegeben hat. 
Es wird eine Zeit geben, in der davon erzählt werden wird, dass es einmal so eine verrückte Sa… [+1683 chars]",,de,'Zeitumstellung'
https://www.stern.de/gesellschaft/regional/niedersachsen-bremen/gesundheit--therapeuten-kaempfen-gegen-corona-folgen-bei-schuelern-35621038.html,https://www.stern.de/gesellschaft/regional/niedersachsen-bremen/gesundheit--therapeuten-kaempfen-gegen-corona-folgen-bei-schuelern-35621038.html,0,www.stern.de,Gesundheit: Therapeuten kämpfen gegen Corona-Folgen bei Schülern,"Einsamkeit, Ängste und Erschöpfung sind bei vielen Kindern und Jugendlichen in der Corona-Zeit entstanden. Mehr Fachkräfte in Grundschulen und Therapieplätze könnten helfen.",https://image.stern.de/35621040/t/Wh/v1/w1440/r1.7778/-/08--f5za7732bbv17axs2048jpeg---2405e48a9bc9c699.jpg,2025-04-08T04:00:38Z,,"Kopiere den aktuellen Link
Zur Merkliste hinzufügen
Einsamkeit, Ängste und Erschöpfung sind bei vielen Kindern und Jugendlichen in der Corona-Zeit entstanden. Mehr Fachkräfte in Grundschulen und Th… [+2288 chars]",,de,'Einsamkeit'
https://www.n-tv.de/ratgeber/Finanziell-stabil-Wie-Geldsorgen-die-Gesundheit-belasten-article25687854.html,https://www.n-tv.de/ratgeber/Finanziell-stabil-Wie-Geldsorgen-die-Gesundheit-belasten-article25687854.html,0,www.n-tv.de,"Körper, Geist und Seele: Finanziell stabil? Wie Geldsorgen die Gesundheit belasten","Schulden können krank machen und sich negativ auf Körper, Geist und Seele auswirken. Den Kopf in den Sand zu stecken, hilft aber nicht. Was man für die eigene finanzielle Gesundheit tun kann.",https://www.n-tv.de/img/incoming/crop23732293/3061325656-cImg_16_9-w1200/91aea339fdadafbf28971f6625aa3e40.jpg,2025-04-08T08:43:06Z,,"Schulden können krank machen und sich negativ auf Körper, Geist und Seele auswirken. Den Kopf in den Sand zu stecken, hilft aber nicht. Was man für die eigene finanzielle Gesundheit tun kann.
Dauerh… [+5377 chars]",,de,'Geldsorgen'
https://www.stern.de/gesellschaft/regional/hamburg-schleswig-holstein/gesundheit--wo-schueler-jetzt-psychologische-hilfe-finden-35621038.html,https://www.stern.de/gesellschaft/regional/hamburg-schleswig-holstein/gesundheit--wo-schueler-jetzt-psychologische-hilfe-finden-35621038.html,0,www.stern.de,Gesundheit: Wo Schüler jetzt psychologische Hilfe finden,"Einsamkeit, Angst und Erschöpfung haben bei vielen Kindern und Jugendlichen in der Corona-Zeit zugenommen. Eine neue Online-Plattform soll helfen – nicht nur den Schülern.",https://image.stern.de/35622870/t/IB/v1/w1440/r1.7778/-/08--7z2tddssyyv5axs2048jpeg---391e8cf8db210295.jpg,2025-04-08T12:02:48Z,,"Kopiere den aktuellen Link
Zur Merkliste hinzufügen
Einsamkeit, Angst und Erschöpfung haben bei vielen Kindern und Jugendlichen in der Corona-Zeit zugenommen. Eine neue Online-Plattform soll helfen… [+4904 chars]",,de,'Einsamkeit'
https://www.welt.de/kultur/plus255891322/Mehr-Verschwendung-wagen-Nicht-das-Sparen-ist-pervers-Aber-die-Sparer-die-das-Leben-vergessen.html,https://www.welt.de/kultur/plus255891322/Mehr-Verschwendung-wagen-Nicht-das-Sparen-ist-pervers-Aber-die-Sparer-die-das-Leben-vergessen.html,0,www.welt.de,"Nicht das Sparen ist pervers. Aber die Sparer, die das Leben vergessen","Die Börsen krachen. Altmodische Angst-Sparer könnten jetzt triumphieren: Doch zu viele machen es immer noch so wie die Großelterngeneration. Am Ende war zwar ihr Sparkonto voll, aber ihr Leben oft voller Bitternis, Einsamkeit und Unglück. Sie waren typische D…",https://img.welt.de/img/kultur/mobile255891178/9357930257-ci16x9-w1200-fnov-fpotl-fpi157750653/Caucasian-woman-driving-car-at-high-speed.jpg,2025-04-09T05:46:44Z,http://archive.md/20250411135941/https://www.welt.de/kultur/plus255891322/Mehr-Verschwendung-wagen-Nicht-das-Sparen-ist-pervers-Aber-die-Sparer-die-das-Leben-vergessen.html,"Die Börsen krachen. Altmodische Angst-Sparer könnten jetzt triumphieren: Doch zu viele machen es immer noch so wie die Großelterngeneration. Am Ende war zwar ihr Sparkonto voll, aber ihr Leben oft vo… [+67 chars]",,de,'Einsamkeit'
https://www.tagesspiegel.de/wissen/einsamkeit-statt-romantik-warum-junge-menschen-von-berlin-oft-enttauscht-werden-13507624.html,https://www.tagesspiegel.de/wissen/einsamkeit-statt-romantik-warum-junge-menschen-von-berlin-oft-enttauscht-werden-13507624.html,0,www.tagesspiegel.de,Einsamkeit statt Romantik: Warum junge Menschen von Berlin oft enttäuscht werden,"Wer nach Berlin zieht, bewegt sich oft zwischen Verheißung und Ernüchterung. Die romantische Erwartung von jungen Menschen prallt auf die herausfordernde Realität. Doch Psychologen wissen, was hilft.",https://www.tagesspiegel.de/images/13514074/alternates/BASE_16_9_W1400/1744198640000/einsam009-serious-thoughtful-woman-in-train-car.jpeg,2025-04-09T13:42:54Z,http://archive.md/20250409135829/https://www.tagesspiegel.de/wissen/einsamkeit-statt-romantik-warum-junge-menschen-von-berlin-oft-enttauscht-werden-13507624.html,"Lange Wege, hohe Mieten, sozialer Druck und Einsamkeit viele junge Menschen, die voller Erwartungen und Großstadt-Romantisierungen nach Berlin ziehen, erleben große Ernüchterung. Besonders auf TikTok… [+235 chars]",,de,'Einsamkeit'
https://www.zeit.de/gesellschaft/2025-04/charles-schumann-interviewpodcast-alles-gesagt,https://www.zeit.de/gesellschaft/2025-04/charles-schumann-interviewpodcast-alles-gesagt,0,www.zeit.de,"Charles Schumann: Charles Schumann, wie geht die perfekte Bar?","Er sollte Priester werden, wurde Model und ist heute Deutschlands bekanntester Barmann. Im Podcast spricht er über Einsamkeit und verrät, wann er am glücklichsten war.",https://img.zeit.de/kultur/2025-04/charles-schumann-interviewpodcast-alles-gesagt-aufmacher/wide__1300x731,2025-04-11T07:39:25Z,http://archive.md/20250411081108/https://www.zeit.de/gesellschaft/2025-04/charles-schumann-interviewpodcast-alles-gesagt,"1 / 22 Pfeil nach links
Pfeil nach rechts
1/22© Amelie Niederbuchner für ZEIT ONLINE
2/22© Amelie Niederbuchner für ZEIT ONLINE
3/22© Amelie Niederbuchner für ZEIT ONLINE
4/22© Amelie Niederbuch… [+3841 chars]",,de,'Einsamkeit'
